### ISSUE TITLE
Chrome sends port 80 SYN/ACK/FIN despite valid rules?

### ISSUE THREAD

**Issue by semenko** [EFForg/https-everywhere#150]
While trying to implement declarativeWebRequests for issue #132, I noticed Chrome sending some SYNs to port 80 that I don't think should be. I think I missed this earlier having scoped Wireshark to "http" instead of port 80.

Try, e.g. the rule for en.wikipedia.org
https://github.com/EFForg/https-everywhere/blob/master/src/chrome/content/rules/Wikimedia.xml

tcpdump/Wireshark show a handshake & immediate FIN on port 80:

```
22:20:21.979130 IP 192.168.1.14.55851 > text-lb.eqiad.wikimedia.org.http: Flags [S], seq 3650291652, win 65535, options [mss 1460,nop,wscale 4,nop,nop,TS val 337177919 ecr 0,sackOK,eol], length 0
22:20:22.024873 IP text-lb.eqiad.wikimedia.org.http > 192.168.1.14.55851: Flags [S.], seq 54350754, ack 3650291653, win 14480, options [mss 1460,sackOK,TS val 4247761202 ecr 337177919,nop,wscale 9], length 0
22:20:22.024940 IP 192.168.1.14.55851 > text-lb.eqiad.wikimedia.org.http: Flags [.], ack 1, win 8235, options [nop,nop,TS val 337177963 ecr 4247761202], length 0
22:20:23.591796 IP text-lb.eqiad.wikimedia.org.http > 192.168.1.14.55851: Flags [S.], seq 54350754, ack 3650291653, win 14480, options [mss 1460,sackOK,TS val 4247761582 ecr 337177963,nop,wscale 9], length 0
22:20:23.591832 IP 192.168.1.14.55851 > text-lb.eqiad.wikimedia.org.http: Flags [.], ack 1, win 8235, options [nop,nop,TS val 337179512 ecr 4247761582], length 0
22:20:28.813958 IP text-lb.eqiad.wikimedia.org.http > 192.168.1.14.55851: Flags [F.], seq 1, ack 1, win 29, options [nop,nop,TS val 4247762883 ecr 337179512], length 0
22:20:28.814002 IP 192.168.1.14.55851 > text-lb.eqiad.wikimedia.org.http: Flags [.], ack 2, win 8235, options [nop,nop,TS val 337184714 ecr 4247762883], length 0
```

I'm not sure this is a real disclosure (I mean, we make a very similar SYN/ACK on 443), but it's odd.

Opening an issue here, though I may report his at http://crbug.com too (if this isn't our fault).
