### ISSUE TITLE
Some http www.google.com urls do not get transformed into https and thus go through port 80

### ISSUE THREAD

**Issue by ghost** [EFForg/https-everywhere#4078]
On this webpage: https://www.google.com/settings/storage
There's this http link: http://www.google.com/drive/about.html
**EDIT4:** google fixed this link (sometime between feb 13th and feb 20th), it is now: https://www.google.com/drive/

(you may have to be already logged into google to see it, unsure - yes, you have to be logged!)
which when clicked, with 'Block All HTTP requests' already set/enabled, it will do nothing! Because it's not transformed into https.
 When copy pasted into a new tab, into the address bar, again, it's not transformed into https.
 However, when cutting out the part with `drive/about.html`  then it DOES get transformed into `https` !!

I'm trying to get the people from google to fix their `http` link on that webpage but so far they are reluctant to do it. Maybe they will change their minds once they see the tcpdump actually going through port 80 when visiting that link with 'Block All HTTP requests' _disabled_. Remains to be seen. (**EDIT1:** I guess I shouldn't have used the 'Contact Us' link on that webpage, but instead the 'Send Feedback' one from gmail's(**EDIT2:** or google drive's) gear icon - I'm being told **EDIT3:** in order to get this seen by google engineers)

Two questions arise:
1. Why isn't https-everywhere magically redirecting to https when visiting the link from the address bar directly, but does work for http://www.google.com/ for example ?
2. Isn't [HSTS](https://en.wikipedia.org/wiki/HTTP_Strict_Transport_Security) supposed to kick in and actually force the browser(firefox 44.0) to go https when visiting that link?!(given that I've already visited google.com and assuming it does use HSTS to ensure any future visits are forced through https)
  Because it's clearly going through port 80 and leaking all cookies\* in the process.
- the cookies that are set to be sent for 'Any type of connection' (but not those set to be sent for 'Encrypted connections only')

Here's the relevant tcpdump which you'll get when visiting this link http://www.google.com/drive/about.html with 'Block All HTTP requests' disabled in https-everywhere (which is the default btw):

``` tcpdump
    192.168.44.222.38338 > 145.236.72.25.80: Flags [S], cksum 0x76c8 (correct), seq 2784404304, win 29200, options [mss 1460,sackOK,TS val 833589 ecr 0,nop,wscale 7], length 0
    3  09:39:36.891848 00:30:88:1a:20:4f > 40:2d:47:a2:d6:f5, RRCP-0xa2 query
    4  09:39:36.891929 IP (tos 0x0, ttl 59, id 58506, offset 0, flags [none], proto TCP (6), length 60)
    145.236.72.25.80 > 192.168.44.222.38338: Flags [S.], cksum 0xf846 (correct), seq 1510482334, ack 2784404305, win 28960, options [mss 1414,sackOK,TS val 1602200680 ecr 833589,nop,wscale 7], length 0
    5  09:39:36.892141 IP (tos 0x0, ttl 64, id 7014, offset 0, flags [DF], proto TCP (6), length 52)
    192.168.44.222.38338 > 145.236.72.25.80: Flags [.], cksum 0x9718 (correct), seq 1, ack 1, win 229, options [nop,nop,TS val 833597 ecr 1602200680], length 0
    6  09:39:36.892765 IP (tos 0x0, ttl 64, id 7015, offset 0, flags [DF], proto TCP (6), length 1124)
    192.168.44.222.38338 > 145.236.72.25.80: Flags [P.], cksum 0x05a7 (correct), seq 1:1073, ack 1, win 229, options [nop,nop,TS val 833597 ecr 1602200680], length 1072: HTTP, length: 1072
    GET /drive/about.html HTTP/1.1
    Host: www.google.com
    User-Agent: Mozilla/5.0 (X11; Linux x86_64; rv:44.0) Gecko/20100101 Firefox/44.0
    Accept: text/html,application/xhtml+xml,application/xml;q=0.9,*/*;q=0.8
    Accept-Language: en-US,en;q=0.5
    Accept-Encoding: gzip, deflate
    Cookie: NID=76=SkNKD6vPwfklpHZwkG07cK56DzKWsnA1gpZVl3x1_fxbEhGURkHafRsKOsOPlWxx4-dR-_qkDE-vKuK5ioPR9UuSPEChnGESFebxBVi9loH7PMgi4YeCx4UyNvvkoNQGAbuhoz3-P9dLO4rwpNwFQ84rBDANmDwID8pHRhZwld0bZ1SwSFxiYoq87ZeKUKBr8LBHUmqApO8dbEBNob8d31cYvyqrbLTLnpRwb01v; OGPC=5061821-10:; OGP=-5061451:-5061821:; CONSENT=YES+HU.en+20160124-18-1; SID=DQAAAP0AAACDWfs6-CL9OMG9E_DXU0Bdbe-hHLsjnq91zSxCSyljhYDzft2_nheKg7vUWshehmFp2Vx6NGrrkdXpX8QyXkd8qzGWs3OEieDtVsmaZfAniitNfWiRNIlVHXElKV5rPTQ5SDPerVF9l9TBSZhdQu0tQzjm-ifM4cigulDF8a7Oy4q9Ivb_f-aJeyl8r3o96E9BIIyF0AkX-le-J4ISAZo5-SYJF732OVJRY876FXlhbr_M1VVJDFGBPtr9FjjRdZpNP3t4CyrkAkL_4-O58lSHCUgQpf9SVB1spevBHU1h2XLG39oSTnLjM2eMZHYsVo-BO0A2dJ-K-w9fkYJLL2q7; HSID=AJHDq-jMuiIc3tFQP; APISID=5odGGFK_kZ5rKe30/AdRcy2EaiK3bmANxc; GMAIL_RTT=266
    DNT: 1
    Connection: keep-alive

    7  09:39:36.899960 00:30:88:1a:20:4f > 40:2d:47:a2:d6:f5, RRCP-0xa2 query
    8  09:39:36.900066 IP (tos 0x0, ttl 59, id 58507, offset 0, flags [none], proto TCP (6), length 52)
    145.236.72.25.80 > 192.168.44.222.38338: Flags [.], cksum 0x92d2 (correct), seq 1, ack 1073, win 243, options [nop,nop,TS val 1602200688 ecr 833597], length 0
    9  09:39:36.919987 00:30:88:1a:20:4f > 40:2d:47:a2:d6:f5, RRCP-0xa2 query
   10  09:39:36.920075 IP (tos 0x0, ttl 59, id 58525, offset 0, flags [none], proto TCP (6), length 642)
    145.236.72.25.80 > 192.168.44.222.38338: Flags [P.], cksum 0x901d (correct), seq 1:591, ack 1073, win 243, options [nop,nop,TS val 1602200708 ecr 833597], length 590: HTTP, length: 590
    HTTP/1.1 301 Moved Permanently
    Location: http://www.google.com/drive/index.html
    Content-Type: text/html; charset=UTF-8
    X-Content-Type-Options: nosniff
    Date: Sat, 30 Jan 2016 14:10:04 GMT
    Expires: Mon, 29 Feb 2016 14:10:04 GMT
    Server: sffe
    Content-Length: 235
    X-XSS-Protection: 1; mode=block
    Cache-Control: public, max-age=2592000
    Age: 325773

    <HTML><HEAD><meta http-equiv="content-type" content="text/html;charset=utf-8">
    <TITLE>301 Moved</TITLE></HEAD><BODY>
    <H1>301 Moved</H1>
    The document has moved
    <A HREF="http://www.google.com/drive/index.html">here</A>.
    </BODY></HTML>
   11  09:39:36.920159 IP (tos 0x0, ttl 64, id 7016, offset 0, flags [DF], proto TCP (6), length 52)
    192.168.44.222.38338 > 145.236.72.25.80: Flags [.], cksum 0x9059 (correct), seq 1073, ack 591, win 238, options [nop,nop,TS val 833625 ecr 1602200708], length 0
   12  09:39:37.083956 IP (tos 0x0, ttl 64, id 7017, offset 0, flags [DF], proto TCP (6), length 1124)
    192.168.44.222.38338 > 145.236.72.25.80: Flags [P.], cksum 0x0244 (correct), seq 1073:2145, ack 591, win 238, options [nop,nop,TS val 833788 ecr 1602200708], length 1072: HTTP, length: 1072
    GET /drive/index.html HTTP/1.1
    Host: www.google.com
    User-Agent: Mozilla/5.0 (X11; Linux x86_64; rv:44.0) Gecko/20100101 Firefox/44.0
    Accept: text/html,application/xhtml+xml,application/xml;q=0.9,*/*;q=0.8
    Accept-Language: en-US,en;q=0.5
    Accept-Encoding: gzip, deflate
    Cookie: NID=76=SkNKD6vPwfklpHZwkG07cK56DzKWsnA1gpZVl3x1_fxbEhGURkHafRsKOsOPlWxx4-dR-_qkDE-vKuK5ioPR9UuSPEChnGESFebxBVi9loH7PMgi4YeCx4UyNvvkoNQGAbuhoz3-P9dLO4rwpNwFQ84rBDANmDwID8pHRhZwld0bZ1SwSFxiYoq87ZeKUKBr8LBHUmqApO8dbEBNob8d31cYvyqrbLTLnpRwb01v; OGPC=5061821-10:; OGP=-5061451:-5061821:; CONSENT=YES+HU.en+20160124-18-1; SID=DQAAAP0AAACDWfs6-CL9OMG9E_DXU0Bdbe-hHLsjnq91zSxCSyljhYDzft2_nheKg7vUWshehmFp2Vx6NGrrkdXpX8QyXkd8qzGWs3OEieDtVsmaZfAniitNfWiRNIlVHXElKV5rPTQ5SDPerVF9l9TBSZhdQu0tQzjm-ifM4cigulDF8a7Oy4q9Ivb_f-aJeyl8r3o96E9BIIyF0AkX-le-J4ISAZo5-SYJF732OVJRY876FXlhbr_M1VVJDFGBPtr9FjjRdZpNP3t4CyrkAkL_4-O58lSHCUgQpf9SVB1spevBHU1h2XLG39oSTnLjM2eMZHYsVo-BO0A2dJ-K-w9fkYJLL2q7; HSID=AJHDq-jMuiIc3tFQP; APISID=5odGGFK_kZ5rKe30/AdRcy2EaiK3bmANxc; GMAIL_RTT=266
    DNT: 1
    Connection: keep-alive

   13  09:39:37.110320 00:30:88:1a:20:4f > 40:2d:47:a2:d6:f5, RRCP-0xa2 query
   14  09:39:37.110504 IP (tos 0x0, ttl 59, id 58593, offset 0, flags [none], proto TCP (6), length 624)
    145.236.72.25.80 > 192.168.44.222.38338: Flags [P.], cksum 0x3190 (correct), seq 591:1163, ack 2145, win 260, options [nop,nop,TS val 1602200899 ecr 833788], length 572: HTTP, length: 572
    HTTP/1.1 301 Moved Permanently
    Location: https://www.google.com/drive/
    Content-Type: text/html; charset=UTF-8
    X-Content-Type-Options: nosniff
    Date: Sat, 30 Jan 2016 14:10:04 GMT
    Expires: Mon, 29 Feb 2016 14:10:04 GMT
    Server: sffe
    Content-Length: 226
    X-XSS-Protection: 1; mode=block
    Cache-Control: public, max-age=2592000
    Age: 325773

    <HTML><HEAD><meta http-equiv="content-type" content="text/html;charset=utf-8">
    <TITLE>301 Moved</TITLE></HEAD><BODY>
    <H1>301 Moved</H1>
    The document has moved
    <A HREF="https://www.google.com/drive/">here</A>.
    </BODY></HTML>
   15  09:39:37.110605 IP (tos 0x0, ttl 64, id 7018, offset 0, flags [DF], proto TCP (6), length 52)
    192.168.44.222.38338 > 145.236.72.25.80: Flags [.], cksum 0x8867 (correct), seq 2145, ack 1163, win 247, options [nop,nop,TS val 833815 ecr 1602200899], length 0
   16  09:39:37.159219 IP (tos 0x0, ttl 64, id 60081, offset 0, flags [DF], proto TCP (6), length 163)
    192.168.44.222.52782 > 145.236.72.25.443: Flags [P.], cksum 0xb4cc (correct), seq 1891073757:1891073868, ack 3487991628, win 1394, options [nop,nop,TS val 833864 ecr 1602188329], length 111
   17  09:39:37.166485 00:30:88:1a:20:4f > 40:2d:47:a2:d6:f5, RRCP-0xa2 query
   18  09:39:37.166550 IP (tos 0x0, ttl 59, id 58610, offset 0, flags [none], proto TCP (6), length 52)
    145.236.72.25.443 > 192.168.44.222.52782: Flags [.], cksum 0xd846 (correct), seq 1, ack 111, win 378, options [nop,nop,TS val 1602200955 ecr 833864], length 0
   19  09:39:37.199568 00:30:88:1a:20:4f > 40:2d:47:a2:d6:f5, RRCP-0xa2 query
   20  09:39:37.199648 IP (tos 0x0, ttl 59, id 58620, offset 0, flags [none], proto TCP (6), length 236)
    145.236.72.25.443 > 192.168.44.222.52782: Flags [P.], cksum 0x4d0c (correct), seq 1:185, ack 111, win 378, options [nop,nop,TS val 1602200988 ecr 833864], length 184
   21  09:39:37.199705 00:30:88:1a:20:4f > 40:2d:47:a2:d6:f5, RRCP-0xa2 query
   22  09:39:37.199758 00:30:88:1a:20:4f > 40:2d:47:a2:d6:f5, RRCP-0xa2 query
   23  09:39:37.199909 IP (tos 0x0, ttl 59, id 58621, offset 0, flags [none], proto TCP (6), length 1454)
    145.236.72.25.443 > 192.168.44.222.52782: Flags [.], cksum 0x3e27 (correct), seq 185:1587, ack 111, win 378, options [nop,nop,TS val 1602200988 ecr 833864], length 1402
   24  09:39:37.200067 IP (tos 0x0, ttl 64, id 60082, offset 0, flags [DF], proto TCP (6), length 52)
    192.168.44.222.52782 > 145.236.72.25.443: Flags [.], cksum 0xcdd3 (correct), seq 111, ack 1587, win 1394, options [nop,nop,TS val 833904 ecr 1602200988], length 0
   25  09:39:37.200232 00:30:88:1a:20:4f > 40:2d:47:a2:d6:f5, RRCP-0xa2 query
   26  09:39:37.200321 IP (tos 0x0, ttl 59, id 58622, offset 0, flags [none], proto TCP (6), length 698)
    145.236.72.25.443 > 192.168.44.222.52782: Flags [P.], cksum 0xecd7 (correct), seq 1587:2233, ack 111, win 378, options [nop,nop,TS val 1602200988 ecr 833864], length 646

```

Here's the link in context:
![link is where the mouse is screenshot_2016-02-02_11-06-02](https://cloud.githubusercontent.com/assets/17016209/12777815/822457aa-ca5f-11e5-8bfa-055cc6cee9fe.png)

What else can I say? I'm outraged! Outraged I say :)))) /jk

**Comment by semenko** [comment]
Briefly:
- Some URLs are excluded in the Google rules, because they're broken over TLS
- Google doesn't set HSTS on their root: `curl -I https://www.google.com`

**Comment by aoaaxy** [comment]
Workaround:
Using this firefox addon: https://addons.mozilla.org/en-US/firefox/addon/enforce-encryption/
I was able to enable HSTS on www.google.com and thus now when clicking that `http` link in OP will open it just fine as `https` in a new tab.

As it says in the About (reproducing here):

```
    Go to the encrypted (HTTPS) version of the webpage.
    Right-click somewhere on the page and choose "Page Info" from the menu.
    Switch to the "Security" tab.
    If it says "No" next to "Enforce encrypted connection?" click "Start enforcing".
```

**Comment by aoaaxy** [comment]
FYI, the free 2GB of drive storage that you can get today by completing the security check, [as Ars reports](http://arstechnica.com/gadgets/2016/02/today-you-can-get-2gb-of-google-drive-storage-for-free/), has a link to the [page](https://www.google.com/settings/storage) still containing the ['http' link](http://www.google.com/drive/about.html) and thus leaking some of your cookies if you do click it (see OP above).

![2gb](https://cloud.githubusercontent.com/assets/17016209/12923853/a1a3b2e0-cf57-11e5-8c79-c05fb7b39026.png)

**Comment by wesdawg** [comment]
I'm also noticing this on 404 pages or pages that aren't whitelisted in Google.xml rule (e.g. #13467).

![google_404_nohttps](https://user-images.githubusercontent.com/5124946/32348676-e83fd726-bfea-11e7-9ea3-29fd6249d958.png)

Is there a reason why the rule can't just cover everything except exclusions and special redirects instead of requiring whitelisting specific URLs ?
